nom, pic_name, nom_site, lien_site, linkedin, twitter
Alain Ottenheimer, alaino, datasens.fr, http://datasens.fr/, http://linkedin.com/in/alainottenheimer, https://twitter.com/datasensTls
Alain Roan, alainr, perceptible.fr, https://perceptible.fr/, https://www.linkedin.com/in/alain-roan-186361/, https://twitter.com/AlainRoan
Christophe Bontemps, christophe, Chargé de cours statisticien – CESAP (ONU), http://data.visualisation.free.fr/, https://www.linkedin.com/in/cbontemps/, https://twitter.com/Xtophe_Bontemps
Christophe Regouby, christopheR, Data Scientist - Airbus, https://github.com/cregouby, https://fr.linkedin.com/in/christophe-regouby-b4613848
Vincent Vivanloc, vincent, "dataviz & Dev/DevOps IoT", https://vvivanloc.github.io/index.beta.html, https://www.linkedin.com/in/vvivanloc/, https://twitter.com/Ze_n0p

